{
  "$schema": "https://json-schema.org/draft/2020-12/schema",
  "$id": "https://denoclaw.dev/schemas/agent.schema.json",
  "title": "DenoClaw Agent Configuration",
  "description": "Defines an agent's identity, permissions, peers, and execution policy. Lives in data/agents/<id>/agent.json.",
  "type": "object",
  "properties": {
    "$schema": {
      "type": "string",
      "description": "JSON Schema reference (ignored at runtime)"
    },
    "description": {
      "type": "string",
      "description": "Human-readable description of what this agent does"
    },
    "model": {
      "type": "string",
      "description": "LLM model override (e.g. 'ollama/nemotron-3-super'). Inherits from global defaults if omitted.",
      "examples": [
        "ollama/nemotron-3-super",
        "anthropic/claude-sonnet-4-6",
        "openai/gpt-4o"
      ]
    },
    "temperature": {
      "type": "number",
      "minimum": 0,
      "maximum": 2,
      "description": "LLM temperature override. Inherits from global defaults if omitted."
    },
    "maxTokens": {
      "type": "integer",
      "minimum": 1,
      "description": "Max tokens override. Inherits from global defaults if omitted."
    },
    "systemPrompt": {
      "type": "string",
      "description": "Inline system prompt. Prefer soul.md file instead for longer prompts."
    },
    "sandbox": {
      "$ref": "#/$defs/SandboxConfig"
    },
    "peers": {
      "type": "array",
      "items": { "type": "string" },
      "uniqueItems": true,
      "description": "Agent IDs this agent can send tasks to (ADR-006). Empty = cannot send to anyone. Closed by default."
    },
    "acceptFrom": {
      "type": "array",
      "items": { "type": "string" },
      "uniqueItems": true,
      "description": "Agent IDs this agent accepts tasks from. Use '*' to accept from all. Empty = accepts from no one. Closed by default."
    },
    "channels": {
      "type": "array",
      "items": { "type": "string" },
      "uniqueItems": true,
      "description": "Channel names this agent is assigned to (e.g. 'telegram', 'webhook')"
    },
    "channelRouting": {
      "type": "string",
      "enum": ["direct", "round-robin", "by-intent", "broadcast"],
      "description": "How messages from assigned channels are routed to this agent"
    }
  },
  "required": ["sandbox"],
  "additionalProperties": false,
  "$defs": {
    "SandboxPermission": {
      "type": "string",
      "enum": ["read", "write", "run", "net", "env", "ffi"],
      "description": "Deno permission flag for the sandbox subprocess"
    },
    "SandboxConfig": {
      "type": "object",
      "description": "Sandbox execution environment configuration (ADR-005)",
      "properties": {
        "backend": {
          "type": "string",
          "enum": ["local", "cloud"],
          "default": "local",
          "description": "Sandbox backend: 'local' = Deno.Command subprocess, 'cloud' = Deno Sandbox API"
        },
        "allowedPermissions": {
          "type": "array",
          "items": { "$ref": "#/$defs/SandboxPermission" },
          "uniqueItems": true,
          "description": "Maximum permissions the agent can use. Actual sandbox permissions = intersection of tool needs and agent allows (ADR-005)."
        },
        "networkAllow": {
          "type": "array",
          "items": { "type": "string" },
          "description": "Network hostnames/patterns the sandbox can access",
          "examples": [["api.example.com", "*.github.com"]]
        },
        "maxDurationSec": {
          "type": "integer",
          "minimum": 1,
          "default": 30,
          "description": "Maximum execution time per tool call in seconds"
        },
        "execPolicy": {
          "$ref": "#/$defs/ExecPolicy"
        },
        "shell": {
          "$ref": "#/$defs/ShellConfig"
        },
        "privilegeElevation": {
          "type": "object",
          "description": "Optional broker-owned temporary privilege elevation flow for this agent",
          "properties": {
            "enabled": {
              "type": "boolean",
              "default": true,
              "description": "Whether broker-side temporary privilege elevation may be requested for this agent"
            },
            "scopes": {
              "type": "array",
              "items": {
                "type": "string",
                "enum": ["once", "task", "session"]
              },
              "uniqueItems": true,
              "description": "Allowed temporary elevation scopes for this agent"
            },
            "requestTimeoutSec": {
              "type": "integer",
              "minimum": 1,
              "default": 300,
              "description": "How long an INPUT_REQUIRED privilege-elevation request stays resumable"
            },
            "sessionGrantTtlSec": {
              "type": "integer",
              "minimum": 1,
              "default": 1800,
              "description": "TTL for session-scoped temporary privilege elevation grants"
            }
          },
          "additionalProperties": false
        }
      },
      "required": ["allowedPermissions"],
      "additionalProperties": false
    },
    "ShellConfig": {
      "type": "object",
      "description": "Shell execution mode. 'direct' keeps binary+args semantics. 'system-shell' delegates to a host shell interpreter.",
      "properties": {
        "enabled": {
          "type": "boolean",
          "default": true,
          "description": "Whether the shell tool may be used when exposed by the runtime"
        },
        "mode": {
          "type": "string",
          "enum": ["direct", "system-shell"],
          "default": "direct",
          "description": "'direct' uses Deno.Command(binary, args); 'system-shell' uses a shell interpreter and enables pipes, redirects and command chaining"
        },
        "warnOnLocalSystemShell": {
          "type": "boolean",
          "default": true,
          "description": "Emit a warning when 'system-shell' is used on the local backend"
        }
      },
      "additionalProperties": false
    },
    "ExecPolicy": {
      "description": "Shell command execution policy. `security` is the active control surface.",
      "oneOf": [
        {
          "type": "object",
          "description": "Deny all shell execution",
          "properties": {
            "security": { "const": "deny" }
          },
          "required": ["security"],
          "additionalProperties": false
        },
        {
          "type": "object",
          "description": "Allow any direct command without an allowlist (dangerous — does not imply shell interpreter semantics such as pipes or &&)",
          "properties": {
            "security": { "const": "full" },
            "envFilter": {
              "type": "array",
              "items": { "type": "string" },
              "description": "Additional env prefixes to strip (on top of LD_*, DYLD_*)"
            }
          },
          "required": ["security"],
          "additionalProperties": false
        },
        {
          "type": "object",
          "description": "Allow only direct commands whose binary is in allowedCommands (recommended)",
          "properties": {
            "security": { "const": "allowlist" },
            "allowedCommands": {
              "type": "array",
              "items": { "type": "string" },
              "uniqueItems": true,
              "description": "Binary names the agent is allowed to execute (e.g. 'git', 'deno', 'npm')"
            },
            "deniedCommands": {
              "type": "array",
              "items": { "type": "string" },
              "uniqueItems": true,
              "description": "Keywords blocked anywhere in command string (aggressive match)"
            },
            "envFilter": {
              "type": "array",
              "items": { "type": "string" },
              "description": "Additional env prefixes to strip (on top of LD_*, DYLD_*)"
            },
            "allowInlineEval": {
              "type": "boolean",
              "default": false,
              "description": "Allow -c/-e flags on interpreters (node -e, python -c). Default false = blocked."
            }
          },
          "required": ["security"],
          "additionalProperties": false
        }
      ]
    }
  }
}
